{
  "categories": [
    {
      "aliases": [
        "品牌",
        "brand"
      ],
      "id": "brand",
      "risk": "high"
    },
    {
      "aliases": [
        "目标受众",
        "人群",
        "audience"
      ],
      "id": "audience",
      "risk": "high"
    },
    {
      "aliases": [
        "传播目标",
        "营销目标",
        "objective"
      ],
      "id": "objective",
      "risk": "high"
    },
    {
      "aliases": [
        "交付物",
        "成片",
        "deliverable"
      ],
      "id": "deliverable",
      "risk": "high"
    },
    {
      "aliases": [
        "时长",
        "片长",
        "视频长度"
      ],
      "id": "duration",
      "risk": "high"
    },
    {
      "aliases": [
        "CTA",
        "行动号召",
        "引导语"
      ],
      "id": "call_to_action",
      "risk": "critical"
    },
    {
      "aliases": [
        "卖点",
        "信息点",
        "talking point"
      ],
      "id": "talking_point",
      "risk": "high"
    },
    {
      "aliases": [
        "禁用内容",
        "禁止项",
        "prohibited content"
      ],
      "id": "prohibited_content",
      "risk": "critical"
    },
    {
      "aliases": [
        "广告披露",
        "声明",
        "disclosure"
      ],
      "id": "disclosure",
      "risk": "critical"
    },
    {
      "aliases": [
        "语气",
        "调性",
        "tone"
      ],
      "id": "tone",
      "risk": "normal"
    },
    {
      "aliases": [
        "平台",
        "渠道",
        "platform"
      ],
      "id": "platform",
      "risk": "normal"
    },
    {
      "aliases": [
        "截止时间",
        "交付日期",
        "deadline"
      ],
      "id": "deadline",
      "risk": "high"
    }
  ],
  "compilers": [
    "write_ad_script"
  ],
  "id": "advertising_brief",
  "locales": [
    "zh-CN"
  ],
  "modality_lexicon": {
    "informational": [
      "仅供参考",
      "背景信息"
    ],
    "may": [
      "可以",
      "可选"
    ],
    "must": [
      "必须",
      "务必",
      "需要"
    ],
    "must_not": [
      "不得",
      "禁止",
      "避免"
    ],
    "should": [
      "建议",
      "最好"
    ]
  },
  "schema_version": "domain-pack/1.0",
  "validators": [
    "duration_validator",
    "date_validator"
  ],
  "version": "1.0.0"
}
